{
  "schema_version": "0.1.0",
  "generated_at": "2026-08-10T00:00:00Z",
  "source": "MB-SM-076A2",
  "note": "TEST FIXTURE FALLBACK only (MB-SM-076A2/076A3). Production Home prefers SyS/A_Tools/ProjectOps/v0.1/State/PROJECT.REGISTRY.json. CloseReport row is explicit NOT_ENROLLED — not a live enrolled runtime.",
  "projects": [
    {
      "PROJECT_ID": "SM-LAB-004",
      "PROJECT_ROOT_IDENTITY": "99.LABS/SM-LAB-004_SKILLS_IMPROVEMENT_VERTICAL_SLICE",
      "PROJECT_TYPE": "LAB",
      "PROJECT_CLASS": "ENROLLED_PROJECT",
      "ENROLMENT_STATUS": "ENROLLED",
      "ENROLMENT_METHOD": "NEW_PROJECT",
      "ENROLLED_AT": "2026-08-07T00:00:00Z",
      "CAPABILITY_BASELINE": "SKILL.LAB.LONG_RUNNING_RUNNER_HEARTBEAT@1.1.0",
      "IMPROVEMENT_FLOW_ENABLED": true,
      "PROJECT_SYNC_ENABLED": true,
      "LAST_OBSERVED_AT": "LAB_RUN",
      "LAST_SYNC_ID": "LAB",
      "LAST_RECEIPT_ID": "LAB",
      "AUTHORITY_MODEL": "SKILLSMACHINE_PACKAGE_EXCHANGE_ONLY",
      "IMPROVEMENT_FLOW_STATUS": "NONE",
      "PROJECT_SYNC_STATUS": "CURRENT",
      "ATTENTION": "NONE",
      "CREATED_BY_SKILLSMACHINE": true,
      "EXPLICITLY_ENROLLED_IN_SKILLSMACHINE": true
    },
    {
      "PROJECT_ID": "CloseReport",
      "PROJECT_ROOT_IDENTITY": "C:\\01. GitHub\\CloseReport",
      "PROJECT_TYPE": "PRODUCT",
      "PROJECT_CLASS": "EXISTING_UNINTEGRATED_PROJECT",
      "ENROLMENT_STATUS": "NOT_ENROLLED",
      "ENROLMENT_METHOD": null,
      "ENROLLED_AT": null,
      "CAPABILITY_BASELINE": "UNKNOWN",
      "IMPROVEMENT_FLOW_ENABLED": false,
      "PROJECT_SYNC_ENABLED": false,
      "LAST_OBSERVED_AT": "076A2_READ_ONLY",
      "LAST_SYNC_ID": null,
      "LAST_RECEIPT_ID": null,
      "AUTHORITY_MODEL": "PROJECT_LOCAL_MUTATION_REQUIRED",
      "IMPROVEMENT_FLOW_STATUS": "NONE",
      "PROJECT_SYNC_STATUS": "UNKNOWN",
      "ATTENTION": "ENROLMENT_REQUIRED",
      "CREATED_BY_SKILLSMACHINE": false,
      "EXPLICITLY_ENROLLED_IN_SKILLSMACHINE": false,
      "RECEIVING_BOUNDARY_00_SKILLSMACHINE": "ABSENT"
    }
  ]
}
